{
  "incidentTitle": "NPE in UserProfileService",
  "timeWindow": {
    "firstTimestamp": "2026-01-07 14:23:45.055",
    "lastTimestamp": "2026-01-07 14:23:45.110"
  },
  "requestIds": ["req-a1b2-c3d4"],
  "primaryErrorLine": "2026-01-07 14:23:45.102 [http-nio-8080-exec-5] ERROR c.e.service.UserProfileService - An unexpected error occurred while processing user request.",
  "primaryException": {
    "class": "java.lang.NullPointerException",
    "message": "Cannot invoke \"String.toUpperCase()\" because \"user.getEmail()\" is null"
  },
  "topAppFrames": [
    "com.example.service.UserProfileService.formatUserData(UserProfileService.java:42)",
    "com.example.service.UserProfileService.getUserDetails(UserProfileService.java:28)",
    "com.example.controller.UserController.getUser(UserController.java:15)"
  ],
  "causedByChain": [],
  "signals": [
    "2026-01-07 14:23:45.055 [http-nio-8080-exec-5] INFO  c.e.filter.RequestLoggingFilter - Incoming request: GET /api/v1/users/profile/9921 [RequestId: req-a1b2-c3d4]",
    "2026-01-07 14:23:45.058 [http-nio-8080-exec-5] DEBUG c.e.security.JwtAuthenticationProvider - Token validation successful for subject: user_9921",
    "2026-01-07 14:23:45.080 [http-nio-8080-exec-5] INFO  c.e.service.UserProfileService - Fetching raw user entity from database for ID: 9921",
    "2026-01-07 14:23:45.095 [http-nio-8080-exec-5] DEBUG c.e.repository.UserRepository - Hibernate: select u1_0.id, u1_0.email, u1_0.name from users u1_0 where u1_0.id=?",
    "2026-01-07 14:23:45.102 [http-nio-8080-exec-5] ERROR c.e.service.UserProfileService - An unexpected error occurred while processing user request.",
    "2026-01-07 14:23:45.105 [http-nio-8080-exec-5] ERROR o.s.w.s.DispatcherServlet - Servlet.service() for servlet [dispatcherServlet] in context with path [] threw exception [Request processing failed]",
    "2026-01-07 14:23:45.108 [http-nio-8080-exec-5] INFO  c.e.exception.GlobalExceptionHandler - Resolving exception to HTTP 500 Internal Server Error.",
    "2026-01-07 14:23:45.110 [http-nio-8080-exec-5] INFO  c.e.filter.RequestLoggingFilter - Completed request: GET /api/v1/users/profile/9921 [RequestId: req-a1b2-c3d4] - Duration: 55ms"
  ],
  "componentsDetected": ["SpringMVC", "Hibernate", "Security"],
  "securityFlags": [],
  "noiseDroppedCount": 5,
  "notes": "Request failed with HTTP 500 due to NullPointerException in business logic."
}
